"name","num_library","create_date","area","is_fenxiao","type_name","school_nature_name","address","content"
"河北北方学院","142万","1923","1568","2","综合类","公办","河北省张家口市高新区钻石南路11号","河北北方学院地处北京2022年冬奥会和冬残奥会举办地之一张家口市。集长城草原之灵蕴，得张垣文化之精髓，办学历史悠久，文化积淀深厚，是河北省西北部具有硕士学位授予权的综合性省属本科院校。学校是经国家教育部批准，于2003年9月由张家口医学院、张家口师范专科学校和张家口农业高等专科学校三所省属高校合并组建而成。张家口医学院的前身是1945年建立的晋察冀"
"河北工程大学","232万","1952","4098","2","理工类","公办","河北省邯郸经济技术开发区太极路19号","河北工程大学是河北省重点骨干大学，河北省人民政府与水利部共建高校，河北省重点支持的国内一流大学建设高校，河北省文明单位，坐落在中国历史文化名城、“成语典故之都”邯郸市。办学条件优良，校园环境优美。学校新校区总占地面积4098亩，建筑面积76.32万平方米。现有教职工2433人，有双聘院士1人、国家“万人计划”科技领军人才1人、“新世纪百千万人才工程”"
"河北建筑工程学院","55万","1950","810","2","理工类","公办","河北省张家口市朝阳西大街13号","河北建筑工程学院坐落在被誉为“第二延安”和“长城博物馆”美称的冬奥名城张家口市，学校办学历史可追溯到1950年成立的察哈尔张家口市技术学校，1978年升格为本科高校“河北建筑工程学院”，是国务院批准的首批具有学士学位授予权院校，2008年在教育部本科教学工作水平评估中获得“优秀”，2013年批准为硕士学位授予单位，是河北省唯一以培养土木建筑类专业人才为"
"华北科技学院","114万","1950","800","2","理工类","公办","河北廊坊三河燕郊开发区学院大街467号","华北科技学院是应急管理部直属高校，前身是1950年创建的中央燃料工业部干部学校；1955年划归煤炭部，更名为煤炭工业部干部学校；1982年升格为北京煤炭管理干部学院；1985年成立中国煤矿安全技术培训中心，同学校实行“一套机构、两块牌子”的管理体制；1993年转制为普通高等学校，更名为华北矿业高等专科学校；2002年升格为普通本科院校，更名为华北科技学院；2011年获"
"河北地质大学","137万","1953","2321","2","理工类","公办","主校区：河北省石家庄市槐安东路136号,北校区：河北省石家庄市景源街26号","河北地质大学创办于1953年，是原地质部直属五大院校之一，是国家自然资源部、河北省人民政府共建大学，省属重点骨干大学，地质学家、中国科学院院士李廷栋任学校名誉校长。作为新中国最早设置经济管理类专业的原地质部直属院校，学校始终以“为资源环境可持续发展提供人才和科技支撑”为核心使命，秉承“达观博物”的校训，弘扬“艰苦奋斗，求实创新”的光荣传"
"石家庄铁道大学","200万","1950","0","2","理工类","公办","校本部：河北省石家庄市北二环东路17号,龙山校区：河北省石家庄市元氏县姬村镇龙山路1号","--------河北省重点骨干大学省部局共建高校石家庄铁道大学前身是中国人民解放军铁道兵工程学院，创建于1950年，系当时全军重点院校；1979年被列为全国重点高等院校；1984年转属铁道部，更名为石家庄铁道学院；2000年划转河北省，实行中央与地方共建，为河北省重点骨干大学；2010年3月更名为石家庄铁道大学；2015年7月被河北省人民政府、国家铁路局、教育部批准为共建高校"
"中国人民警察大学","105万","1981","1700","2","政法类","公办","廊坊校区：河北省廊坊市安次区西昌路220号,广州校区：广东省广州市天河区奥体南路399号","中国人民警察大学前身为中国人民武装警察部队学院，1981年4月24日经国务院批准成立，主要为公安现役部队培养指挥管理和专业技术警官，承担我国维和警察、成建制维和警察防暴队、常备维和警队、驻外警务联络官和外籍警察培训任务，担负公安机关培训工作。2000年，中国维和警察培训中心在学院正式成立。2003年，获得硕士学位授予权。1997年、2008年、2016年，先后以优异"
"广东职业技术学院","0","1985","1224","2","综合类","公办","校本部：广东省佛山市禅城区澜石二路20号,高明校区：广东省佛山市高明区西江新城学府路8号,南海校区：广东省佛山市南海区官窑教育路31号","广东职业技术学院是由广东省人民政府举办的全日制普通高等职业院校，行政主管部门是广东省教育厅。其前身为广东省纺织工业学校，筹建于1984年,1985年正式招生，1993年被评为省级重点中专学校，2000年被评为国家级重点中专学校，2001年升格为广东纺织职业技术学院。2012年，经广东省人民政府批准，学校更名为广东职业技术学院。2021年7月，与广东省工业贸易职业技术学校"
"邢台学院","60万","1910","943","2","综合类","公办","主校区：河北省邢台市桥东区泉北东大街88号,机电工程学院校区：河北省邢台市桥西区泉北西大街1169号","邢台学院始建于1910年，前身直隶第四初级师范学堂，1996年3月，邢台师范专科学校、邢台教育学院、邢台经济管理干部学校三校合并，成立邢台师范高等专科学校。2002年，经教育部批准升格为“邢台学院”，是一所省市共建、以市为主的全日制普通本科院校。2014年5月通过本科教学工作合格评估，2016年12月被确定为硕士学位授权立项建设单位。2020年9月，学校获批教育部中华优"
"唐山学院","55万","1956","1253","2","综合类","公办","河北省唐山市大学西道9号","唐山学院地处中国近代工业的摇篮、素有“京东宝地”之美誉的河北省唐山市，是一所以工为主，工、经、管、文、法、艺等多学科协调发展的公办全日制普通本科院校。1956年建校，前身为建立在原唐山铁道学院（现西南交通大学）内的唐山市工业夜大学。1985年，西南交通大学智力支援唐山成立了唐山分校。1996年，学校与西南交通大学开始联办本科专业，先后培养了8届毕业"
"中央司法警官学院","72万","1956","443","2","政法类","公办","河北省保定市七一中路103号","中央司法警官学院是司法部直属唯一全日制普通高等警察院校，肩负着为全国司法行政系统特别是监狱、戒毒和社区矫正机关培养高素质后备人才的重任，被誉为我国“司法警官的摇篮”。学校地处河北省保定市，毗邻雄安新区，始建于1956年，原名公安部劳改工作干部学校，1983年划归司法部管理，1985年成立中央劳改劳教管理干部学院，1995年更名为中央司法警官教育学院，1999"
"广东工贸职业技术学院","0","1957","1100","2","理工类","公办","天河校区：广东省广州市天河区广州大道北963号,白云校区：广东省广州市白云区钟落潭镇广从九路688号,荔湾校区：广东省广州市荔湾区芳村大道西滘口街5号","广东工贸职业技术学院是广东省人民政府直属的全日制普通高等职业院校，是中国特色高水平高职学校和专业建设计划建设单位、广东省示范性高职院校、广东省一流高职院校（18所之一）建设单位和广东省安全文明校园，是全国现代学徒制试点单位、全国首批1+X证书制度试点院校，国家示范性职业教育集团单位、广东省示范性职业教育集团单位，国家节约型公共机构示范创建"
"广东建设职业技术学院","0","1979","1000","2","理工类","公办","广州校区：广东省广州市白云区广花二路638号,清远校区：广东省清远市清城区东城街道环城东路38号","广东建设职业技术学院是省内唯一一所公办建筑类高职院，是建筑业高素质技术技能人才培养的主要基地和“现代鲁班”摇篮。办学43年来，学校扎根南粤大地，服务“一带一路”，培养培训了20多万名高素质技术技能型人才，为广东省建设行业与经济社会发展做出了积极贡献。学校前身是1979年成立的广东省建筑工程技工学校；1986年成立的广东省建筑工程学校；2001年5月经广东"
"广东机电职业技术学院","20万","1963","1037","2","理工类","公办","南校区：广东省广州市白云区同和街道蟾蜍石东路2号,北校区：广东省广州市白云区钟落潭高职园区马沥路,西校区：广州市白云区均禾街鹤龙二路1121号","广东机电职业技术学院坐落在广州市白云区，是一所隶属于广东省教育厅的公办全日制工科类普通高等职业院校。学院办学历史悠久，前身为创建于1963年的广东省农业机械化技工学校，历经“广东省农业机械技术学校”、“广东省农业机电学校”、“广东省机电学校”等发展阶段。2001年，经广东省人民政府批准，学校升格为高等职业院校，翻开了高质量发展的崭新篇章。学院"
"广东交通职业技术学院","0","1959","1300","2","理工类","公办","天河校区：广东省广州市天河区天源路789号,花都校区：广东省广州市花都区工业大道11号","广东交通职业技术学院（以下简称学院）的前身是1959年成立的广东交通学校和1960年成立的广东省航运学校。1999年经教育部批准，将两校合并组建广东交通职业技术学院。2008年7月由广东省交通运输厅整建制划转广东省教育厅管理。2022年10月，广东省华侨职业技术学校、广东省科技职业技术学校通过省属职业院校集团办学并入学院。学院坚持立足广东，服务区域经济与社会发展"
"唐山师范学院","170万","1956","1190","2","师范类","公办","大学道校区：河北省唐山市建设北路156号,学院路校区：河北省唐山市学院路41号","唐山师范学院是河北省省属公立全日制普通本科高等院校。学校位于河北省唐山市高新技术开发区。唐山北依燕山，南临渤海，西与京津接壤，东与秦皇岛毗邻，是河北省经济强市。唐山区位优势突出、环境优美、底蕴深厚，为学校发展创造了优越条件。学校前身为创办于1956年的唐山速成师范专科学校，1988年被原国家教委评为“全国优秀师专”，2000年经教育部批准改建为本"
"广东水利电力职业技术学院","33万","1952","1500","2","理工类","公办","天河校区：广东省广州市天河区天寿路122号,从化校区：广东省广州市从化区环市东路767号","广东水利电力职业技术学院是一所行业特色鲜明的省属公办全日制高等职业院校。学校隶属于广东省教育厅，前身为创建于1952年的广州土木水利工程学校，1999年升格为高等职业院校。学校是国家“双高”计划建设单位、国家骨干高职院校、全国优质水利高职院校、全国水利职业教育示范院校，是广东省一流高职院校、广东省示范性高等职业院校，第四届全国文明单位。先后入"
"广东省外语艺术职业学院","0","1978","648","2","综合类","公办","五山校区：广东省广州市天河区瘦狗岭路463号,燕岭校区：广东省广州市天河区燕岭路495号,海珠校区：广州市海珠区新港中路艺苑南路29号,龙洞校区：广州市天河区龙洞东路128号,天平架校区：广州市天河区天平架兴华直街338号","广东省外语艺术职业学院是广东省人民政府举办的全日制普通高等职业院校。学校为“广东省示范性高等职业院校”“广东省大学生创新创业教育示范学校”“广东省依法治校示范校”“广东省安全文明校园”“广东省绿色学校”。2022年9月，学校成为广东省省域高水平高等职业院校建设计划立项建设单位。办学历史悠久广东省外语艺术职业学院创办于2001年12月，前身是广东省"
"山东师范大学","395万","1950","3850","2","师范类","公办","千佛山校区：山东省济南市历下区文化东路88号,长清湖校区：山东省济南市长清区大学科技园大学路1号","山东师范大学坐落在历史文化名城济南。建校70余年来，学校植根齐鲁文化沃土，汲取泉城人文灵韵，秉承“尊贤尚功、奋发有为”的校园精神和“弘德明志、博学笃行”的校训，自觉传承创新齐鲁文化，努力彰显教师教育特色，目前已发展成为一所学科专业齐全、学位体系完备、师资人才充沛、社会声誉优良的综合性高等师范院校。办学历史沿革学校办学文脉可追溯到1902年"
"廊坊师范学院","140万","1946","1545","2","师范类","公办","东校区：河北省廊坊市爱民西道100号 ,西校区：河北省廊坊市固安县城东","廊坊师范学院是一所省属本科师范院校，办学历史可追溯至1914年的安次县立师范讲习所，1946年更名为安次县立简易师范学校，1956年改建为河北廊坊师范学校，1964年升格为廊坊师范专科学校。2000年经教育部批准再次升格为廊坊师范学院，是河北省最早的两所专升本院校之一。2005年，经河北省人民政府批准，河北职业技术学院并入，组建新的廊坊师范学院。2016年被确定为硕士"
"河北体育学院","26万","1985","500","2","体育类","公办","河北省石家庄市学府路82号","河北体育学院是河北省唯一一所独立建制的本科普通高等体育院校。1984年4月，经河北省政府批准，在河北师范学院体育系整建制基础上筹建并开始招生。1985年8月，国家教委正式批准在河北省体育运动学校校址基础上建院。2005年6月，河北省体育运动学校实质性并入河北体育学院。行政主管部门是河北省体育局。学校现有两个校区，学府路校区（占地500余亩）坐落在河北省会"
"衡水学院","44万","1923","1272","2","综合类","公办","河北省衡水市和平西路1088号","这是一所创始于1923年的学府，这是一个被命名为“全国文明单位”的高校，这是一所以实现“师生共同进步”为目标的本科大学——衡水学院，坐落在有“北方湖城”美誉的河北省衡水市市区，校园占地面积32.1万平方米，校舍建筑面积33.8万平方米，固定资产总值7.6亿元。校园风景优美，环境宜人，荣膺“全国部门造林绿化400佳”、“河北省爱国卫生先进单位”，三次荣获“"
"石家庄学院","103万","1958","1221","2","综合类","公办","北校区：河北省石家庄市高新技术产业开发区长江大道6号,南校区：河北省石家庄市高新技术产业开发区珠峰大街288号","石家庄学院是经教育部批准建立的全日制公办普通本科院校。学校地处河北省石家庄市高新技术产业开发区，由南北两个校区组成，交通便捷，环境优美。学校前身为1958年建立的石家庄专区师范学院。1977年以来，先后在藁城、正定、获鹿牛山办学。1982年，经国务院批准，正式定校名为石家庄师范专科学校。1983年迁入石家庄市北郊滹沱河畔校区。1996年3月经河北省人民政府批"
"邯郸学院","90万","1905","1193","2","师范类","公办","邯郸学院本部：河北省邯郸市学院北路530号,邯郸学院大名分院：河北省邯郸市大名县京府大街43号","邯郸学院位于国家历史文化名城、国家优秀旅游城市、太极拳圣地、成语典故之都河北省邯郸市，是一所公办全日制普通本科院校。办学历史始于1905年成立的邯郸县初级师范学堂，1982年升格为邯郸师范专科学校，2004年升格为本科院校并定名为邯郸学院，2012年通过教育部本科教学合格评估，2016年被列为河北省硕士学位授予权立项建设单位，2017年通过教育部本科教学审核评估"
"广东文艺职业学院","0","1950","300","2","艺术类","公办","番禺校区：广东省广州市番禺区市广路242号,白云校区：广东省广州市白云区广州大道北同泰路1111号","文以载道，艺以弘德。广东文艺职业学院是一所具有光荣历史传统和深厚文化积淀的大学，始建于1950年，前身是由毛泽东主席题写校名、叶剑英元帅亲自创办的“华南人民文学艺术学院”。1985年，成立“华南文艺业余大学”，校长由省委宣传部副部长、省文联党组书记杜埃兼任，刘田夫、欧阳山任名誉校长，文艺大家关山月、黎雄才、郭绍纲、杨之光担任顾问。1995年更名为"
"广东亚视演艺职业学院","0","2000","800","2","艺术类","民办","校本部：广东省肇庆市德庆县致庆大道西39号","广东亚视演艺职业学院由孙彦军（国家一级演员，经典版三国演义刘备扮演者）联合创办于2000年，是一所经广东省人民政府批准成立、教育部备案、纳入国家统一招生计划的全日制普通高等院校。学校办学特色鲜明，教学质量良好，教学成果颇丰，师生获奖多项，在省内具有较高的知名度和较大的影响力。2021年我校列入“教育部首批中外人文交流全媒体产教融合项目首批合作"
"广州工程技术职业学院","0","1964","357","2","综合类","公办","校本部：广东省广州市环市东路465号,从化校区：广东省广州市从化区沿江南路302号","广州工程技术职业学院是一所以先进制造、石油化工和信息类专业为主，经、管、商、贸协调发展的综合性高等职业学校。前身为广州业余工业科技学院，1964年经广东省人民政府批准，由广州市总工会和广州市科协联合举办；1973年，更名为广州市业余科技学院；1983年，更名为广州市职工业余大学；1995年，更名为广州市职工大学；2004年，改制为广州工程技术职业学院（以下简"
"广州民航职业技术学院","60万","1980","1112","2","理工类","公办","机场路校区：广东省广州市白云区机场路向云西街10号,白云机场校区：广东省广州市白云国际机场空港北横六路","广州民航职业技术学院直属中国民用航空局，是民航内最早一所独立设置实施高等职业教育的全日制公办普通高校。作为民航高层次技术技能人才培养的国家队、主力军、主基地，学校经过40多年的建设与发展，已成为我国民航专业门类最全、培养规模最大、能力最强、水平最高，享誉国内、在东南亚民航有着较高影响力的职业院校，为我国民航强国建设、粤港澳大湾区和广东"
"广州铁路职业技术学院","23万","2000","800","2","理工类","公办","广东省广州市白云区石井街庆隆中路100号","广州铁路职业技术学院（简称学校）前身为成立于1974年5月22日的原铁道部广州铁路机械学校。2000年6月，经广东省人民政府批准，由广州铁路机械学校、广州铁路运输职工大学与广州铁路成人中等专业学校合并升格为全日制公办高等职业院校。2004年9月，学校由广州铁路（集团）公司（现为中国铁路广州局集团有限公司，简称广铁集团）移交广州市人民政府举办。学校现为国家"
"广州南洋理工职业学院","20万","1984","511","2","理工类","民办","广东省广州市从化区环市东路1123号","广州南洋理工职业学院，是经广东省人民政府批准、国家教育部备案的省属全日制普通高等学校，简称“南洋理工”。学校与广东科技学院、广州华南商贸职业学院同属广东南博教育集团旗下高等院校，依托南博集团雄厚的办学实力与集团化办学优势，取得了卓越的办学成绩，赢得了社会各界一致好评2022年成功入选省级高水平高职院校建设计划。学校坐落在有“广州后花园”"
"广州工商学院","100万","1995","1390","2","财经类","民办","花都校区：广东省广州市花都区狮岭镇海布光明路5号,三水校区：广东省佛山市三水区乐平镇范湖三花公路中23号","广州工商学院是教育部批准设立的非营利性民办全日制普通本科院校，创建于1995年，2014年升格本科。2021年获批成为广东省硕士学位授予立项建设单位、广东省博士工作站新设站单位。2020年入选“广州技术市场15强高校”榜单；2022年，学校位列“中国民办普通本科院校竞争力排行榜”前30强。学校现有广州花都和佛山三水两个校区。地处粤港澳大湾区中心地带，地理位置优越"
"罗定职业技术学院","0","1928","415","2","综合类","公办","广东省罗定市西门岗5号","罗定职业技术学院是2001年5月在罗定师范学校基础上成立的一所公办全日制普通高等职业院校，前身是创建于1928年的罗定县立女子乡村师范学校。学校设立有国家职业技能鉴定所、广东省博士工作站，建立了云浮市云计算大数据人才培养基地、云浮市电子信息产业技术服务中心、云浮市自动化设备工程技术研究中心和云浮市南江文化研究中心，是共青团中央青年创新创业基地"
"茂名职业技术学院","0","1986","1004","2","理工类","公办","文明北校区：广东省茂名市文明北路232号,水东湾新城校区：广东省茂名市电白区沙院镇海城五路1号","茂名职业技术学院是一所以工科为主的公办高职院校,广东省省域高水平高职院校建设高校（培育单位），获评为茂名市文明校园。学校地处中国南方最大的石化生产基地和水果生产基地、建筑之乡、美丽的海滨城市——广东省茂名市，占地面积66.6万平方米（约1000亩），分北校区、南校区、人民南3个校区。学校1986年创校，秉承“修德强技求实创新”校训，坚持“价值观+知识+"
"广东东软学院","0","2002","808","2","理工类","民办","广东省佛山市南海区南海大学城","广东东软学院是经教育部批准设立，由东软出资举办的一所民办普通高等院校。2003年成立南海东软信息技术职业学院,2004年被广东省教育厅确定为“广东省首批省级示范性软件学院”,2005年被国家教育部认定为“国家计算机应用和软件技术专业技能型紧缺人才培养培训基地”。2014年升格为普通本科学校，更名为广东东软学院，开展全日制本科教育。2018年通过新建本科院校学士"
"广东南华工商职业学院","65万","1993","1099","2","财经类","公办","天河校区：广东省广州市天河区沙太南路113号,黄埔校区：广东省广州市黄埔区长洲街长江路320号","1949年，新中国成立后，作为中国工人运动发源地的广东，工会事业蓬勃发展，广东省各级工会急需培养大批有文化、有素质的工会干部，1952年秋，还处于筹建时期的广东省总工会成立了广东省工会干部学校，1960年广东省工会干部学校被撤销，1963年广东省委批准建立广东省工青妇干部学校，1971年广东省革委会下令撤销省工青妇干校。直到1980年，广东省工会干部学校正式恢复"
"中山火炬职业技术学院","45万","2004","200","2","理工类","公办","广东省中山市火炬开发区中山港大道60号","中山火炬职业技术学院创办于2004年4月，孕育于“国家火炬计划”，由中山市人民政府举办，委托中山火炬高技术产业开发区管理，是中山市自己创办的第一所公办高等职业院校，也是全国131所、广东省10所之一、中山市唯一一所集国家示范（骨干）高职院校、国家优质专科高等职业院校和国家“双高计划”建设院校于一身的中国高职“大满贯”学校。学校始终坚持“立足园区"
"珠海艺术职业学院","0","2003","154","2","艺术类","民办","校本部：广东省珠海市金湾区广安路2号","珠海艺术职业学院是南粤大地上一所重要的艺术高等学府。前身为1998年创办的中国舞教学研究院，2003年经广东省人民政府批准，教育部备案，颁发电子注册文凭，纳入国家统一招生计划的全日制普通高等院校(学院代码：12576)。学校有独特的地理优势，坐落在珠海特区金湾大学城，依山傍海，环境优美，毗邻港澳，生活方便。学校临近珠海拱北海关、珠海机场，随着粤港澳大"
"深圳职业技术大学","106万","1993","4509","2","综合类","公办","广东省深圳市南山区西丽街道留仙大道7098号","经教育部党组会议研究决定，同意以深圳职业技术学院为基础整合资源设立深圳职业技术大学，学校标识码为4144011113；同时撤销深圳职业技术学院的建制。深圳职业技术大学为公办本科层次职业学校，首批设置电子信息工程技术、现代通信工程、人工智能工程技术、智能制造工程技术、新能源汽车工程技术、数字动画等6个职业本科专业；学校全日制在校生规模暂定为35000人。"
