"name","num_library","create_date","area","is_fenxiao","type_name","school_nature_name","address","content"
"北京工业大学","0","1960","1440","2","理工类","公办","平乐园校区：北京市朝阳区平乐园100号,通州校区：北京市通州区潞苑南大街89号","北京工业大学（BeijingUniversityOfTechnology）创建于1960年，是一所以工为主，工、理、经、管、文、法、艺术、教育相结合的多科性市属重点大学。1981年成为国家教育部批准的第一批硕士学位授予单位，1985年成为博士学位授予单位，1996年通过国家“211工程”预审，正式跨入国家二十一世纪重点建设的百所大学的行列。2017年9月，学校正式进入国家一流学科建设高校行列并顺利通过"
"北京大学","703万","1898","4117","2","综合类","公办","北京市海淀区颐和园路5号","北京大学创办于1898年，初名京师大学堂，是中国第一所国立综合性大学，也是当时中国最高教育行政机关。辛亥革命后，于1912年改为现名。作为新文化运动的中心和“五四”运动的策源地，作为中国最早传播马克思主义和民主科学思想的发祥地，作为中国共产党最早的活动基地，北京大学为民族的振兴和解放、国家的建设和发展、社会的文明和进步做出了不可替代的贡献，在"
"哈尔滨工业大学","271万","1920","0","2","理工类","公办","黑龙江省哈尔滨市南岗区西大直街92号","2020年6月7日，习近平总书记致信祝贺哈尔滨工业大学（简称哈工大）建校100周年。贺信指出：哈尔滨工业大学历史悠久。新中国成立以来，在党的领导下，学校扎根东北、爱国奉献、艰苦创业，打造了一大批国之重器，培养了一大批杰出人才，为党和人民作出了重要贡献。习近平总书记希望学校在新的起点上，坚持社会主义办学方向，紧扣立德树人根本任务，在教书育人、科"
"云南大学","360万","1922","4367","2","综合类","公办","东陆校区：云南省昆明市翠湖北路2号,呈贡校区：云南省昆明市呈贡区大学城东外环南路","云南大学始建于1922年，时为私立东陆大学，1934年更名为省立云南大学，1938年改为国立云南大学。1946年，《不列颠百科全书》将云南大学列为中国15所世界著名大学之一。1978年，云南大学被国务院确定为全国88所重点大学之一;1996年成为首批列入国家“211工程”重点建设大学;2004年成为教育部和云南省人民政府重点共建高校;2012年成为国家“中西部高校基础能力建设工程”和“"
"西北大学","232万","1902","2360","2","综合类","公办","长安校区：陕西省西安市长安区郭杜教育科技产业区学府大道1号,太白校区：陕西省西安市太白北路229号,桃园校区：陕西省西安市高新四路155号","西北大学肇始于1902年的陕西大学堂和京师大学堂速成科仕学馆。1912年始称西北大学。1923年改为国立西北大学。1937年西迁来陕的国立北平大学、北平师范大学、北洋工学院和北平研究院等组成国立西安临时大学，1938年改为国立西北联合大学，1939年复称国立西北大学。新中国成立后为教育部直属综合大学。1950年复名西北大学。1958年改隶陕西省主管。1978年被确定为全国重点大"
"中央民族大学","140万","1941","570","2","民族类","公办","北京市海淀区中关村南大街27号","中央民族大学（MinzuUniversityofChina）坐落于北京学府林立的海淀区，南邻国家图书馆，北依中关村科技园，校园环境典雅，古朴幽美，人文氛围浓郁，具有鲜明的民族特色。坐落于青龙湖畔的丰台校区于2021年9月正式启用，具有中式经典、山水校园风貌特点，彻底提升了“大文化”与“小空间”的匹配度，为中央民族大学跨越式发展提供了新起点。中央民族大学是党和国家为解"
"内蒙古大学","125万","1957","2233","2","综合类","公办","北校区：内蒙古自治区呼和浩特市赛罕区大学西街235号,南校区：内蒙古自治区呼和浩特市玉泉区昭君路24号","内蒙古大学位于内蒙古自治区首府、历史文化名城呼和浩特市，距北京400余公里，是中华人民共和国成立后党和国家在民族地区创办的第一所综合大学。学校于1957年高起点创办，时任国务院副总理、自治区主席乌兰夫任首任校长（1956—1968），原高教部综合大学司副司长于北辰任副校长，中科院学部委员、著名生物学家、北京大学一级教授、耶鲁大学博士李继侗先生来校执教"
"长安大学","0","1951","3745","2","理工类","公办","北校区：陕西省西安市未央区尚苑路,南校区：陕西省西安市南二环路中段","长安大学直属国家教育部，是国家首批“211工程”重点建设大学、国家“985优势学科创新平台”建设高校、国家“双一流”建设高校。学校创建于新中国百业待兴之时，壮大于改革浪潮迭起之际，兴盛于高等教育强国大势之中，与共和国同向同行七十余载。自1951年起，学校前身西安公路交通大学、西安工程学院、西北建筑工程学院相继成立。1956年开始招收来华留学生。1978年"
"大连海事大学","118万","1909","2070","2","理工类","公办","辽宁省大连市凌海路1号","大连海事大学（原大连海运学院）是交通运输部所属的全国重点大学，是国家“211工程”重点建设高校、国家“双一流”建设高校，是交通运输部、教育部、辽宁省人民政府、大连市人民政府共建高校。学校素有“航海家的摇篮”之称，是中国著名的高等航海学府，是被国际海事组织认定的世界上少数几所“享有国际盛誉”的海事院校之一。大连海事大学的发展历史，代表了"
"北京林业大学","131万","1952","13176","2","农林类","公办","北京市海淀区清华东路35号","北京林业大学是教育部直属、教育部与国家林业和草原局共建的全国重点大学，是国家首批“211工程”重点建设高校和国家“优势学科创新平台”建设项目试点高校，是国家“双一流”建设高校。历史积淀深厚。学校办学历史可追溯至1902年的京师大学堂农业科林学目。1952年全国高校院系调整，北京农业大学森林系与河北农学院森林系合并，成立北京林学院。1956年，北京农业"
"湖南大学","620万","1926","3615","2","综合类","公办","湖南省长沙市岳麓区麓山南路麓山门","湖南大学坐落于中国历史文化名城长沙，前临碧波荡漾的湘江，后倚秀如琢玉的岳麓山，素有“千年学府、百年名校”之称。学校办学起源于公元976年创办的岳麓书院，是中国同址办学时间最长的高等学府,历经千年变迁，弦歌不绝，始终保持文化教育的连续性，是中国高等教育发展的生动缩影和世界高等教育的罕见奇迹。1903年改制为湖南高等学堂，1926年正式定名湖南大学，19"
"中央音乐学院","53万","1949","0","2","艺术类","公办","北京市西城区鲍家街43号","中央音乐学院1949年由中央人民政府政务院命名成立，是由1938年成立的延安鲁迅艺术学院音乐系、1940年建立的重庆国立音乐院、1948年成立的华北大学三部音乐系、1918年成立的国立北平艺术专科学校音乐系等几所音乐教育机构合并组建而成,是一所培养高级专门音乐人才的高等学府。1960年被中共中央定为全国重点高等学校，2000年被列入国家“211工程”建设院校，是全国艺术院校"
"武汉大学","1002万","1893","5195","2","综合类","公办","湖北省武汉市武昌区八一路299号","江城多山，珞珈独秀；山上有黉，武汉大学。武汉大学是国家教育部直属重点综合性大学，是国家“985工程”和“211工程”重点建设高校，是首批“双一流”建设高校。武汉大学溯源于1893年清末湖广总督张之洞奏请清政府创办的自强学堂，历经传承演变，1928年定名为国立武汉大学，是近代中国第一批国立大学。1946年，学校已形成文、法、理、工、农、医6大学院并驾齐驱的办"
"北京交通大学","185万","1896","2000","2","理工类","公办","北京市海淀区西直门外上园村3号","北京交通大学是教育部直属，教育部、交通运输部、北京市人民政府和中国国家铁路集团有限公司共建的全国重点大学，是国家“211工程”“985工程优势学科创新平台”“双一流”建设高校。北京交通大学作为交通大学的三个源头之一，历史渊源可追溯到1896年，前身是清政府创办的铁路管理传习所，是中国第一所专门培养管理人才的高等学校，是中国近代铁路管理、电信教育"
"辽宁大学","275万","1948","2222","2","综合类","公办","沈阳崇山校区：辽宁省沈阳市皇姑区崇山中路66号,沈阳蒲河校区：辽宁省沈阳市沈北新区道义南大街58号","辽宁大学是一所具备文、史、哲、经、管、法、理、工、医、艺等学科门类的综合性大学，是国家“211工程”重点建设院校和国家“双一流”建设高校。学校现有三个校区，即沈阳崇山校区、沈阳蒲河校区和辽阳武圣校区。学校占地面积2222亩，校舍建筑面积65万平方米。辽宁大学源起于1948年11月东北人民政府在沈阳建立的商业专门学校，是中国共产党创建的第一所专门商科高"
"北京航空航天大学","253万","1952","3000","2","理工类","公办","学院路校区：北京市海淀区学院路37号,沙河校区：北京市昌平区沙河高教园区","1951年，为培养航空建设人才，国家决定将北洋大学、厦门大学、西北工学院航空系并入清华大学航空工程学系，成立清华大学航空学院，将云南大学航空系并入四川大学航空系，将西南工专航空科并入华北大学工学院航空系。1952年，根据全国高等学校院系调整的要求，设立北京航空学院，由北京工业学院航空系（1951年11月18日，华北大学工学院更名为北京工业学院）、清华大"
"河北工业大学","102万","1903","4000","2","理工类","公办","天津市北辰区西平道5340号","河北工业大学前身为创办于1903年的北洋工艺学堂，之后相继更名为直隶高等工业学堂、直隶高等工业学校、直隶公立工业专门学校、河北省立工业专门学校、河北省立工业学院、河北省立工学院、河北工学院，1951年与北洋大学合并为天津大学，1958年恢复重建，1962年与天津工学院合并为新的天津工学院，1971年复名河北工学院，1995年定名为河北工业大学。学校1996年跻身首批国"
"北京外国语大学","131万","1941","0","2","语言类","公办","北京市海淀区西三环北路2号","北京外国语大学（简称“北外”）坐落在北京市海淀区西三环北路，在三环路两侧分设东、西两个校区，是教育部直属、首批“211工程”高校、“985”优势学科创新平台高校、首批“双一流”建设高校。北外是中国共产党创办的第一所外国语高等学校，前身是1941年成立于延安的中国抗日军政大学三分校俄文队，后发展为中央军委外国语学校，建校始隶属于党中央领导。新中国"
"中国人民大学","439万","1937","7500","2","综合类","公办","北京市海淀区中关村大街59号","中国人民大学（RenminUniversityofChina）是中国共产党创办的第一所新型正规大学，直属于教育部，由教育部与北京市共建。现任党委书记为张东刚、校长为林尚立。一、历史沿革和领导关怀中国人民大学前身是1937年诞生于抗日战争烽火中的陕北公学，以及后来的华北联合大学和北方大学、华北大学。学校始终与党和国家同呼吸、共命运，始终得到党中央的亲切关怀和高度重视。"
"北京邮电大学","171万","1955","0","2","理工类","公办","北京市西土城路10号","六十余载风雨砥砺，六十余载春华秋实。明光之北、蓟门之南，古老的城墙，见证了永不消逝的电波；鸿雁翱翔、银杏巍巍，坚实的土地，承载了信息黄埔的传奇。北京邮电大学是教育部直属、工业和信息化部共建、首批进行“211工程”建设的全国重点大学，是“985优势学科创新平台”项目重点建设高校，是一所以信息科技为特色、工学门类为主体、工管文理协调发展的多科"
"对外经济贸易大学","60万","1951","513","2","财经类","公办","北京市朝阳区惠新东街10号","对外经济贸易大学（UniversityofInternationalBusinessandEconomics）是教育部直属高校，教育部与商务部共建高校，首批国家“双一流”建设和首批“211工程”建设高校。对外经济贸易大学办学历史悠久，是新中国第一所培养对外贸易专门人才的高等学府，创建于1951年，前身为隶属于中央人民政府贸易部的高级商业干部学校。1953年更名为北京对外贸易专科学校。1954年，北京对外贸易专"
"北京师范大学","290万","1902","0","2","师范类","公办","北京市新街口外大街19号","北京师范大学是教育部直属重点大学，是一所以教师教育、教育科学和文理基础学科为主要特色的著名学府。学校的前身是1902年创立的京师大学堂师范馆，1908年改称京师优级师范学堂，独立设校，1912年改名为北京高等师范学校。1923年学校更名为北京师范大学，成为中国历史上第一所师范大学。1931年、1952年北平女子师范大学、辅仁大学先后并入北京师范大学。百余年来，北"
"北京中医药大学","88万","1956","1625","2","医药类","公办","北京市朝阳区北三环东路11号","北京中医药大学是一所以中医药学为主干学科的全国重点大学，直属教育部管理，由教育部、国家卫生健康委员会、国家中医药管理局和北京市共建。学校现任党委书记王瑶琪，校长徐安龙。北京中医药大学始建于1956年，前身为北京中医学院，是国务院批准最早创办的高等中医药院校。1960年，被中央确定为全国重点高校；1993年，更名为北京中医药大学；1996年，入选国家“211"
"西南交通大学","700万","1896","5000","2","理工类","公办","犀浦校区：四川省成都市郫都区犀安路999号,九里校区：四川省成都市二环路北一段111号,峨眉校区：四川省峨眉山市景区路二段6号","西南交通大学是教育部直属全国重点大学，国家首批“双一流”“211工程”“特色985工程”“2011协同创新计划”重点建设并设有研究生院的研究型大学，坐落于中国历史文化名城、国家中心城市、“成渝地区双城经济圈”核心城市——成都。学校1896年创建于山海关，时称“北洋铁路官学堂”（ImperialChineseRailwayCollege)，是中国第一所工程教育高等学府，是中国土木工程、矿冶工"
"河北大学","310万","1921","2430","2","综合类","公办","校本部：河北省保定市五四东路180号,新校区：河北省保定市七一东路2666号","河北大学是教育部与河北省人民政府“部省合建”高校，河北省重点支持的国家一流大学建设一层次高校。学校始建于1921年，初名天津工商大学，校址位于天津市马场道141号。建校伊始，学校即以本科建制，大学立名，秉持“育中华有为之青年、办德智并育之大学、促中国之现在化”的办学宗旨，致力于培养工商人才。1933年，学校更名为天津工商学院，“实事求是”校训传统"
"中国海洋大学","300万","1924","5200","2","综合类","公办","山东省青岛市崂山区松岭路238号","中国海洋大学是一所海洋和水产学科特色显著、学科门类齐全的教育部直属重点综合性大学，是国家“985工程”和“211工程”重点建设的高校，2017年入选国家“世界一流大学建设高校”（A类）。学校校训是“海纳百川，取则行远”。学校创建于1924年，历经私立青岛大学、国立青岛大学、国立山东大学、山东大学等办学时期，于1959年发展成为山东海洋学院，1960年被国家确定为"
"西安电子科技大学","736万","1931","3945","2","理工类","公办","北校区：陕西省西安市太白南路2号,南校区：陕西省西安市西沣路兴隆段266号","西安电子科技大学是以电子与信息学科为特色，工、理、管、文、经等多学科协调发展的全国重点大学，直属教育部。目前有南、北两个校区，总占地面积3945.33亩，校舍建筑面积142.33万平方米。学校前身是1931年诞生于江西瑞金的中央革命军事委员会无线电学校，是毛泽东等老一辈革命家亲手创建的我党我军第一所工程技术学校，延续着中国高校最长的红色根脉。建校后先后于"
"郑州大学","714万","1956","6100","2","综合类","公办","河南省郑州市科学大道100号","郑州大学（简称郑大，英文简称：ZZU）由河南省人民政府兴办，法定住所地为河南省郑州市科学大道100号。学校总占地面积6100余亩，主校区位于郑州市科学大道100号，主校区南校园位于郑州市大学北路75号，主校区北校园位于郑州市文化路97号，主校区东校园位于郑州市大学北路40号，主校区西校园位于郑州市科学大道157号；现代制造河南实验室（洛阳）位于洛阳市周山大道6号"
"天津大学","263万","1895","6161","2","综合类","公办","卫津路校区：天津市南开区卫津路92号,北洋园校区：天津市津南区雅观路135号","天津大学（TianjinUniversity），简称天大，其前身为北洋大学，始建于1895年10月2日，是中国第一所现代大学，开中国近代高等教育之先河。“甲午战争”失败后，学校在“自强之道以作育人才为本，求才之道以设立学堂为先”的办学宗旨下，由清光绪皇帝御笔朱批，创建于天津，由盛宣怀任首任督办。学校初名北洋大学堂，内设头等学堂（大学本科）和二等学堂（大学预科），"
"河北经贸大学","0","1995","3000","2","财经类","公办","河北省石家庄市学府路47号","河北经贸大学是河北省重点建设的骨干大学，是一所以经济学、管理学、法学为主，兼有文学、理学、工学和艺术学的多学科财经类大学。学校由河北财经学院、河北经贸学院、河北商业高等专科学校等合并组建而成，至今已有69年的办学历史。学校分北、南、西三个校区办学。其中南、西校区为独立学院——经济管理学院，座落于石家庄市西南高教区，占地200余亩。北校区是"
"河北科技大学","191万","1956","2760","2","理工类","公办","河北省石家庄市裕翔街26号","河北科技大学坐落于河北省石家庄市，占地2575亩，由原河北轻化工学院、河北机电学院、河北省纺织职工大学、河北纺织工业学校合并组建而成。1956年举办高等教育，在多年的办学历程中，学校始终坚持“致力于人的全面发展，服务于区域经济建设和社会进步”的办学宗旨，秉承“兴业、尽责”的校训和“进取、协作、奉献”的科大精神，为国家培养了30余万优秀毕业生。学"
"南开大学","361万","1919","6647","2","综合类","公办","八里台校区：天津市南开区卫津路94号,津南校区：天津市海河教育园区同砚路38号,泰达校区：天津市经济开发区宏达街23号","南开大学是教育部直属重点综合性大学，是敬爱的周恩来总理的母校。学校肇始于1904年，成立于1919年，由近代爱国教育家严修、张伯苓秉承教育救国理念创办。1937年校园遭侵华日军炸毁，学校南迁，与北京大学、清华大学组建国立长沙临时大学，1938年迁至昆明改名为国立西南联合大学。1946年回津复校并改为国立。新中国成立以来，学校发展始终得到党和国家的亲切关怀。毛"
"湖南师范大学","300万","1938","3000","2","师范类","公办","湖南省长沙市麓山路36号","湖南师范大学创建于1938年，位于历史文化名城长沙，是国家“211工程”重点建设的大学，国家“双一流”建设高校，教育部与湖南省重点共建“双一流”建设高校，教育部普通高等学校本科教学工作水平评估优秀高校，湖南省“世界一流学科建设高校”。学校占地近3000亩，建筑面积131万平方米。主校区西偎麓山，东濒湘江，风光秀丽，是全国绿化“400佳”单位之一。学校设有"
"滨州医学院","240万","1946","1718","2","医药类","公办","烟台校区：山东省烟台市莱山区观海路346号（264003）,滨州校区：山东省滨州市黄河三路522号（256603）","滨州医学院是山东省应用型本科高校、山东省省市共建高校、山东省博士学位授予立项建设单位。前身是始建于1946年的原国立山东大学医学院，1956年3月独立建制为青岛医学院，1970年10月整体搬迁至山东省惠民地区行署驻地北镇办学，1974年11月设立青岛医学院北镇分院，1981年9月改称北镇医学院，1983年3月随驻地更名为滨州医学院，2002年烟台校区投入使用。目前，学校已发展成"
"合肥工业大学","267万","1945","5000","2","理工类","公办","安徽省合肥市屯溪路193号","合肥工业大学是中华人民共和国教育部直属全国重点大学，教育部、工信部和安徽省政府共建高校，国防科工局与教育部共建高校。学校创建于1945年，1960年被中共中央批准为全国重点大学。刘少奇、朱德、董必武、陈毅、邓小平等老一辈无产阶级革命家先后来校视察指导工作，邓小平同志1979年亲笔为学校题写了校名。学校2005年成为国家“211工程”重点建设高校，2009年成为国"
"安徽大学","330万","1928","3239","2","综合类","公办","磬苑校区：安徽省合肥市经济技术开发区九龙路111号,龙河校区：安徽省合肥市蜀山区肥西路3号","安徽大学(AnhuiUniversity)坐落于素有“三国故地、包拯家乡，江淮首郡、吴楚要冲”美誉的历史文化名城、安徽省省会合肥市。学校是世界“双一流”和国家“211工程”建设首批入列高校，是安徽省人民政府与教育部共建高校，是安徽省属重点综合型大学。1928年，安徽大学肇基于时为省会的安庆市，开启安徽现代高等教育之先河，赓续襟江带淮崇教文化之菁华。几经易址，于1956"
"中国科学技术大学","67万","1958","0","2","综合类","公办","安徽省合肥市金寨路96号","中国科学技术大学是中国科学院所属的一所以前沿科学和高新技术为主、兼有医学和特色文科的综合性全国重点大学。学校现有31个学院（学部），含8个科教融合学院；设有苏州高等研究院、上海研究院、北京研究院、先进技术研究院、国际金融研究院、附属第一医院（安徽省立医院）。学校于1958年9月在北京创建，郭沫若任首任校长。这是我党亲手创办的红色大学，是为“两"
"德州学院","0","1971","1992","2","综合类","公办","山东省德州市大学西路566号","德州学院是山东省政府直属全日制综合性普通本科院校，是山东省硕士学位授予立项建设单位、山东省应用型本科高校建设首批支持单位。学校坐落于中国太阳城—山东省德州市，德州地理位置优越，素有“九达天衢”“神京门户”之称，是国家交通运输主枢纽城市，被纳入京津冀协同发展规划，是首都一小时生活圈和省会半小时生活圈城市。学校始建于1971年，前身是德州师"
"安徽理工大学","157万","1945","3540","2","理工类","公办","安徽省淮南市泰丰大街168号","安徽理工大学是安徽省重点建设的特色高水平大学，是安徽省和中华人民共和国应急管理部共建高校，是国家中西部高校基础能力建设工程支持建设的高校，是教育部“卓越工程师教育培养计划”实施高校。学校淮南校区占地约3200亩，合肥校区占地340亩。学校创建于1945年，与合肥工业大学同根同源，是安徽省第一所工科高校。1955年学校由淮南煤矿工业专科学校升格为合肥矿"
"安徽工业大学","267万","1958","2549","2","理工类","公办","佳山校区：安徽省马鞍山市花山区湖东路59号,秀山校区：安徽省马鞍山市马向路1530号","安徽工业大学坐落于长三角与南京毗邻的全国文明城市——安徽省马鞍山市，前身是创建于1958年的马鞍山钢铁工业学校，1977年经国务院批准组建马鞍山钢铁学院；1985年更名为华东冶金学院，隶属于原冶金工业部；1998年划转安徽省，实行“中央与地方共建，以安徽省管理为主”的管理体制；2000年经教育部和安徽省人民政府批准，华东冶金学院和安徽商业高等专科学校合并，组"
