"name","num_library","create_date","area","is_fenxiao","type_name","school_nature_name","address","content"
"大连工业大学艺术与信息工程学院","28万","2002","770","2","理工类","民办","辽宁省大连庄河市学府大街117号","大连工业大学艺术与信息工程学院是一所经教育部批准设立，由大连工业大学按新机制和新模式举办的全日制普通高校（独立学院）。学校成立于2002年6月，现有全日制本科生7500余人。学校先后获得“教育部“1+X证书”试点院校”、“全国综合实力独立学院”、“辽宁省高校毕业生就业工作先进集体”、“辽宁省大学生创业教育示范校”、大连市教育系统“青蓝工程先进集体"
"吉林艺术学院","49万","1946","0","2","艺术类","公办","吉林省长春市自由大路695号","吉林艺术学院是东北三省唯一一所综合性高等艺术院校。学院前身萌发于1946年的东北大学鲁迅文艺学院，1958年组建吉林艺术专科学校，1978年更名为吉林艺术学院，1993年经国务院学位委员会批准成为硕士学位授予单位，2017年获批吉林省博士学位授权立项建设单位，2020年成为吉林省特色高水平应用型建设高校。学院地处得天独厚的城市中心繁华地带，拥有表演、造型、综合、"
"昆明城市学院","117万","2000","1000","2","综合类","民办","云南省昆明市高新区商院路1号,云南省昆明市嵩明职教园区文林路","昆明城市学院（原云南师范大学商学院）2000年6月经教育部批准设立，是云南省首批独立学院之一，属普通高等教育本科层次，2001年7月开始招生，2021年6月经教育部批准转设为昆明城市学院。建院以来，学院全面贯彻党的教育方针，坚持立德树人根本任务，以“办最好的应用型大学、最关爱学生的大学”为愿景，致力于为区域经济社会发展培养专业基础扎实、实践能力强、综"
"平顶山工业职业技术学院","97万","2001","1454","2","理工类","公办","河南省平顶山市湛河区黄河路81号","平顶山工业职业技术学院是由国有特大型企业中国平煤神马集团主办的普通公办高等职业院校，位于中原经济区重要的能源和重工业基地，历史文化名城、中国优秀旅游城市平顶山市，是全国文明单位、首批国家示范性高等职业院校、全国普通高校毕业生就业工作先进集体、国家级优质高等职业院校、国家首批1+X证书制度试点院校。学校前身是原煤炭工业部创建于1956年的平顶"
"广州应用科技学院","0","2000","1420","2","综合类","民办","广东省广州市增城区朱村街朱村大道东432号,肇庆校区：广东省肇庆市鼎湖区莲花镇丰乐路20号","广州应用科技学院是经教育部批准设立的全日制普通本科高校。前身是创办于2000年的广州大学松田学院，2020年12月经教育部批准转设并更现名。学校地处粤港澳大湾区，有广州和肇庆两个校区，占地面积1420亩，面向全国招生，现有在校生20000余人。校园建设依山傍水、布局大气舒朗，体现“山水校园，文礼学府”的理念。愿景：倾心打造粤港澳大湾区应用型大学品牌，将学校"
"北京理工大学珠海学院","0","2004","5000","2","理工类","独立学院","广东省珠海市唐家湾金凤路6号","北京理工大学珠海学院是经中华人民共和国教育部批准，于2004年5月8日正式成立的独立学院，以北京理工大学为办学主体，是其重要战略延伸和组成。学校举办校——北京理工大学，1940年诞生于延安，是中国共产党创办的第一所理工科大学，是新中国成立以来国家历批次重点建设的高校，首批进入国家“211工程”和“985工程”，首批进入“世界一流大学”建设高校A类行列，现"
"上海外国语大学贤达经济人文学院","0","2004","500","2","财经类","民办","虹口校区：上海市虹口区东体育会路390号,崇明校区：上海市崇明区东滩大道999号","国家首批全日制本科独立学院上海外国语大学贤达经济人文学院系国家教育部2004年批准设立的上海首批全日制本科独立学院，2021年获得上海市学位办硕士学位授予单位提早培育项目。由上海外国语大学和上海贤达投资有限公司合作举办。学校现有虹口、崇明两个校区，虹口校区地处市区东北部，毗邻上海外国语大学；崇明校区地处崇明区陈家镇，新古典主义和托斯卡纳风格的"
"大连理工大学城市学院","52万","2003","726","2","理工类","民办","辽宁省大连市保税区广宁路1号","大连理工大学城市学院经国家教育部批准成立于2003年3月，地处美丽的海滨城市--大连。学院是以工学为主，管理学、文学、艺术学等多学科协调发展的新型本科层次高等院校。目前设有计算机工程学院、电子与自动化学院、管理学院、建筑工程学院、外国语学院、艺术与传媒学院6个分院，30个本科专业，面向全国招生。学院积极开展教育、教学改革创新，注重优良学风建设，"
"广州软件学院","0","2002","0","2","理工类","民办","广东省广州市从化区经济开发区高技术产业园 广从南路548号","广州软件学院（原广州大学华软软件学院）成立于2002年，2006年开始实施本科层次的学历教育，前身为广州大学华软软件学院，2020年12月，经教育部批准，广东省人民政府同意，转设为广州软件学院，简称“广软”。学院位于粤港澳大湾区的核心——广州从化经济开发区高技术产业园内，毗邻广州地铁14号线太平站，交通便利。学院是广东省大学生创新创业教育示范学校、国家"
"黄河交通学院","87万","1995","1670","2","理工类","民办","河南省焦作市武陟县迎宾大道333号","●河南省唯一的交通类普通本科高校●河南省高等学校基层党组织建设先进单位●河南省文明学校●河南省学校行风建设先进单位●河南省普通高校毕业生就业工作先进集体●河南省依法治校示范学校●河南省平安校园黄河交通学院是教育部批准的河南省唯一一所以培养交通运输人才为特色的应用型本科高校，现有在校生1.9万余人。建校以来，学校秉承“修德、启智、博学、"
"解放军陆军航空兵学院","0","1999","60","2","军事类","公办","北京市通州区台湖镇","中国人民解放军陆军航空兵学院，副军级，隶属于总参谋部。是全军最年轻的一所兵种院校，是在1999年全军院校体制编制压缩调整的情况下新成立的院校。校园位于北京市通州区，环境优美，交通便利，是一所设计先进、功能齐全、布局合理、特色鲜明，融入了最新设计理念和创新精神的现中国人民解放军陆军航空兵学院代化新型军事院校。学院拥有4万平方米的教学、实验大"
"中国人民解放军战略支援部队航天工程大学","0","1978","3000","2","军事类","公办","北京市怀柔区3380信箱23号","中国人民解放军装备学院是隶属总装备部的正军级军事院校，主要面向全军装备系统和航天领域培养装备指挥技术和航天指挥技术人才。学院是军队2110工程重点建设院校，经过三十多年的发展建设，形成了以军事学为主、军事学与工学、管理学、经济学、理学、法学6个门类相互融合的学位授权体系，拥有一批在全军乃至全国颇具影响的学科专业。现有2个博士后流动站、3个一"
"陆军工程大学","0","2017","11040","2","军事类","公办","海福巷校区：江苏省南京市秦淮区后标营路8号,双龙街校区：江苏省南京市江宁区双龙大道60号","中国人民解放军陆军工程大学，2017年以解放军理工大学、军械工程学院主体和重庆通信学院、工程兵学院、武汉军械士官学校为基础调整组建，是我军人才培养与科学研究并重、工程技术与作战指挥融合的综合性工程大学。校本部坐落于长江之滨、人文荟萃的六朝古都江苏南京，设有通信工程学院、野战工程学院、指挥控制工程学院、国防工程学院、研究生院5个内设学院，另"
"陆军防化学院","0","1950","3000","2","军事类","公办","北京市昌平区","中国人民解放军防化指挥工程学院位于北京市昌平区，占地近3000亩，隶属于中国人民解放军总参谋部，是全军唯一的培养防化指挥与工程技术人才的综合型高等院校。中国人民解放军防化指挥工程学院前身为军委化学兵学校，1950年由毛主席、周总理批准成立。根据新的教学任务规划，中国人民解放军防化指挥工程学院承担学历教育和任职教育双重任务。现有全军重点学科2个"
"武汉纺织大学外经贸学院","42万","2002","1000","2","综合类","民办","湖北省武汉市江夏区藏龙岛科技园栗庙路19号","全国党建工作样板支部培育创建单位全国高校活力团支部中国教育十大责任诚信独立学院全国最佳独立学院湖北省普通专升本举办高校湖北省高校思想政治教育工作先进基层单位湖北省高校“两访两创”活动先进集体湖北省征兵工作突出贡献单位湖北省高校心理健康教育达标中心武汉市平安高校建设优秀单位武汉地区企事业单位平安建设优秀单位武汉纺织大学外经贸学院是2002"
"长春电子科技学院","0","2001","1050","2","理工类","民办","吉林省长春市宽城区学理路333号","长春电子科技学院是一所以光电为特色的高水平现代产业大学。学校始建于2001年，原名长春光学精密机械学院光电信息学院，2002年更名为长春理工大学光电信息学院，2004年4月，经教育部确认为独立学院，2020年经教育部批准转设成为独立设置的本科层次民办普通高等学校，并更名为长春电子科技学院，是全国唯一一所以光电为特色的理工类应用型大学，是全国唯一一所电子科"
"中国人民解放军海军航空大学","0","1950","5300","2","军事类","公办","山东省烟台市芝罘区二马路188号","中国人民解放军海军航空工程学院是一所以培养海军初级指挥军官和航空航天工程技术军官为主的高等军事院校，是海军指挥与工程技术人才培养的主要基地、航空航天领域科研中心和航母骄子的摇篮。学院创建于1950年，是新中国首批组建的军事院校之一，1963年被国防科工委确定为重点院校，1979年被国务院列入全国重点高等院校，1986年获硕士学位授予权，2000年获博士学位授"
"河南工程学院","220万","0","2600","2","理工类","公办","河南省郑州市新郑龙湖祥和路1号","河南工程学院地处河南省省会郑州市，是经国家教育部批准设立的一所省属公办普通本科院校，是河南省重点建设的“示范性应用技术类型本科院校”、国家发改委立项建设的产教融合实训基地、河南省整体转型发展试点院校、河南省硕士学位授予重点立项培育单位、河南省首批“装配式”建筑人才培训基地、河南省首批“中华优秀文化传承基地”、河南省文明校园，荣获河"
"河南开封科技传媒学院","0","2003","1870","2","综合类","民办","河南省开封市金明大道北段","河南开封科技传媒学院创建于2003年，其前身是河南大学民生学院。2009年，河南日报报业集团与河南大学强强联合，共同举办民生学院。2021年2月，经教育部批准，学校转设更名为河南开封科技传媒学院。建校近二十年来，学校先后为国家和社会培养了5万余名优秀毕业生。在软科“中国民办高校排名”中，学校排名全国第五，财经类第一。学校秉承“明德至善慎思笃行”的校训"
"黑龙江外国语学院","0","1993","825","2","语言类","民办","黑龙江省哈尔滨市利民开发区师大南路1号","黑龙江外国语学院坐落在哈尔滨市松北新区，是黑龙江省内唯一一所语言类高校。学校位列校友会2021中国语言类民办大学全国第一名；被评为6星级世界知名、中国顶尖民办大学。2018年学校通过中国教育部本科教学质量合格评估，2019年入选黑龙江省特色应用型本科示范高校。2021年被省教育厅评选为黑龙江省大学生就业工作示范性高校（重点培育）。学校校园占地约55万平方米"
"天津海运职业学院","0","2006","976","2","综合类","公办","天津市津南区海河教育园区雅深路8号","天津海运职业学院(以下简称学院)源于1962年建立的天津市科学技术进修学院。2006年2月，经天津市人民政府批准成立天津海运职业学院，现隶属于天津市教育委员会。学院坐落于海河教育园区，占地面积976亩，建筑面积20万余平方米，在校生一万余名。学院是教育部和天津市政府共建“滨海新区航海运输技能型紧缺人才培养基地”，是国家海事局批准的船员培训机构，具有国际"
"江苏食品药品职业技术学院","0","1960","1269","2","综合类","公办","江苏省淮安市高教园区枚乘东路4号","江苏食品药品职业技术学院是江苏省人民政府主办、江苏省教育厅主管的全日制普通高等学校，为国家示范性（骨干）高职院校、中国特色高水平高职学校和专业建设单位、国家优质高职院校、江苏省高水平高职院校建设单位、教育部首批现代学徒制试点院校、教育部“高等职业学校学习成果积累与转换试点项目”单位、国家自然科学基金依托单位、首批国家示范性职业教育"
"辽宁商贸职业学院","0","1984","111","2","财经类","公办","辽宁省沈阳市沈河区东大营街11号","辽宁商贸职业学院成立于2005年4月，前身是始建于1984年的辽宁农业管理干部学院，是公办省属普通高等职业学院。学院位于中国东北中心城市沈阳，毗邻世界文化遗产清福陵，周边地区教育科研单位集中，校园环境幽雅，学术气氛浓郁，是求知治学的理想之地。学院拥有一支以专业带头人为主导，以优秀中青年教师为骨干，以双师型教师为特色的师资队伍。教师队伍中，副教"
"三亚学院","1000万","2005","3000","2","综合类","民办","海南省三亚市吉阳区学院路191号","三亚学院始建于2005年，位于海南省三亚市，由世界500强企业吉利控股集团出资建设。作为中国成长最快、最具竞争力的综合类民办大学，三亚学院始终坚持党的领导,全面贯彻党的教育方针,坚持社会主义办学方向，围绕“培养什么人、怎样培养人、为谁培养人”这一根本问题，自觉肩负大学使命与历史重任。在贯彻落实党的二十大精神，持续推进办学高质量发展的新征程上，"
"郑州旅游职业学院","86万","1985","2287","2","其他","公办","校本部：河南省郑州市郑东新区金龙路188号,豫英校区：河南省郑州市管城回族区豫英路1号","郑州旅游职业学院前身是郑州旅游学校，创办于1985年，隶属于郑州市人民政府，历经四次跨越发展，于2004年5月经河南省人民政府批准、国家教育部备案成立的公办高等院校。在长期的办学历程中，学校逐步铸练形成了“立德修能、知行合一”的校训、“团结、勤勉、求实、创新”的校风、“严于修身、勤于治学”的教风、“勤学善思、求真致远”的学风。学校占地面积1251亩"
"日照职业技术学院","0","1998","1116","2","综合类","公办","山东省日照市烟台北路16号","日照职业技术学院是1998年经教育部批准成为山东省第一所公办高等职业院校，2014年日照广播电视大学（日照经贸学校）和日照水产技工学校并入我校。学校秉承“理论与实践并重,技术与人文融通”的办学理念，坚持“服务区域经济社会发展,服务学生成长成才”的办学宗旨。学校是中国特色高水平高职学校30强、国家示范性高等职业院校、全国优质专科高等职业院校、全国毕"
"新疆轻工职业技术学院","75万","1958","2200","2","理工类","公办","新疆维吾尔自治区乌鲁木齐市米东区米东南路西四巷1147号","新疆轻工职业技术学院创办于1958年，2000年6月改制为专科层次的高等职业技术学院，是新疆首批高等职业院校，隶属于自治区工业和信息化厅。学院是国家百所骨干示范高职院校、国家优质高等职业学校，全国高职院校服务贡献50强、教育部“首批职业教育德育工作实验基地”，新疆第二产业职教园区理事长单位。李克强总理2010年3月来学院视察时称赞:“二产园区办得好，学校"
"新疆农业职业技术学院","70万","1958","10817","2","农林类","公办","新疆维吾尔自治区昌吉市文化东路29号","新疆农业职业技术学院坐落于丝绸之路经济带核心区，素有“西域咽喉”美誉之称的昌吉市，是一所举办高等职业教育的公办全日制普通高等学校。学院前身是创建于1958年的昌吉农业学校，1988年隶属自治区农业厅改名为新疆农业学校，2000年升格为新疆农业职业技术学院，2008年与原自治区农业干部学校合并，整合为现今的新疆农业职业技术学院。2022年2月，自治区农业农村厅"
"山西老区职业技术学院","0","1991","0","2","综合类","民办","山西省太原市和平北路东流街","山西老区职业技术学院是经山西省人民政府批准、教育部备案，具有颁发国家高等教育学历证书资格的全日制综合性高职院校。学院实行理事会统筹下的分工负责制，设有党委会、行政团队、院务委员会和工会。为弘扬和传承老区精神，学院成立了“老区精神研究中心”，创办了《山西老区职业教育》校刊。学院坐落在省城太原汾河西畔和平北路东流街，地理位置优越，交通"
"浙江商业职业技术学院","60万","1911","592","2","财经类","公办","浙江省杭州市滨江区滨文路470号","浙江商业职业技术学院前身为创办于1911年的杭州中等商业学堂。一百多年来，学校秉承“诚、毅、勤、朴”的校训，坚持“育人为本，服务社会”的办学方针，培养了一大批专业技术人才，涌现出经济学家骆耕漠、爱国人士章乃器等著名校友，被誉为“浙商人才培养的摇篮”。现为国家优质专科高等职业院校、中国特色高水平专业群建设单位、全国首批现代学徒制试点高校、"
"西交利物浦大学","50万","2006","610","2","综合类","中外合作办学","江苏省苏州市苏州工业园区独墅湖科教创新区仁爱路111号","西交利物浦大学（XJTLU，简称“西浦”）是经中国教育部批准，由西安交通大学和英国利物浦大学合作创立的，具有独立法人资格和鲜明特色的新型国际大学。她是中国目前规模最大的中外合作大学，以理工管起步，强强合作，拥有中华人民共和国学士学位和英国利物浦大学学位授予权。国际领先的高等教育西交利物浦大学面向海内外招收本科生、研究生，目前开设48个本科专"
"湖州职业技术学院","0","1979","601","2","综合类","公办","浙江省湖州市学府路299号","湖州职业技术学院是一所由湖州市人民政府主办、经浙江省人民政府批准成立的全日制公办高职院校。学校位于长三角中心区域、太湖南岸、国家历史文化名城、全国生态文明先行示范区——浙江湖州。学校前身为1979年创建的嘉兴供销技工学校、嘉兴粮食技工学校、浙江电大嘉兴分校，1999年开始高等职业教育办学。学校占地面积601亩，建筑面积26万平方米，校园具有典型的江"
"浙江建设职业技术学院","0","1958","1000","2","理工类","公办","浙江省杭州市萧山高教园区","浙江建设职业技术学院坐落于杭州钱塘江畔，是浙江省唯一一所公办建设类全日制高等职业院校。前身是创办于1958年的浙江省建筑工业学校，2002年1月，经浙江省政府批准正式成立。办学60多年来，学校先后被确定为中国特色高水平高职学校建设单位（专业群A类）、国家优质高职院校、国家骨干高等职业院校、全国职业院校数字校园建设样板校、全国毕业生就业典型经验高校"
"四川警察学院","92万","1950","452","2","政法类","公办","泸州校区：四川省泸州市江阳区龙透关路186号,成都校区：四川省成都市双流区云岭路36号","四川警察学院是由四川省人民政府主办，省公安厅与省教育厅按职责分工共同管理的全省唯一一所全日制政法公安类普通本科院校。学校始于1950年建立的川西人民行政公署公安厅公安学校，2000年建立四川警官高等专科学校，2006年建立四川警察学院，2011年获批警务专业硕士研究生培养试点单位，2018年获批硕士学位授予单位，是全国省属公安院校中第六所升本、第一所开展警务"
"浙江工商职业技术学院","0","1914","958","2","财经类","公办","浙江省宁波市海曙区机场路1988号","浙江工商职业技术学院是浙江省人民政府首批批准成立的四所全日制公办普通高等职业院校之一，前身为创建于1914年的“宁波公立甲种商业学校”。学校现为浙江省高水平高职学校建设单位、全国高职高专人才培养工作水平评估优秀学校、浙江省示范性高等职业院校，浙江省优质高等职业院校。在2021年GDI高职高专排行TOP1000榜中，学校位列全国第54名，全省第8名。学校主校区"
"台州职业技术学院","0","2001","505","2","综合类","公办","浙江省台州市经济开发区学院路788号","台州职业技术学院是一所政府举办的全日制普通高等学校，地处中国民营经济发祥地之一、长三角南翼重要制造业基地、东南沿海现代化港口城市——浙江省台州市。学校筹建于1999年；2001年5月，浙江省人民政府批准建立台州职业技术学院；2003年、2006年，浙江省台州工业学校和浙江贸易经济学校先后成建制并入。2007年，学校顺利通过教育部高职高专人才培养工作水平优秀评"
"浙江经贸职业技术学院","0","1979","575","2","财经类","公办","浙江省杭州市下沙高教园东区学林街280号","浙江经贸职业技术学院是由浙江省供销合作社举办的全日制公办高职学校。其前身是创办于1979年的浙江供销学校和创办于1984年的浙江省供销社职工学院。2018年，经省编办同意，在浙江经贸职业技术学院的基础上增挂“浙江合作经济管理学院”，实行“两块牌子一套班子”管理。学校位于浙江省杭州市钱塘区下沙高教园区，占地面积575亩。目前，学校设有信息技术学院、财务"
"浙江横店影视职业学院","0","2008","580","2","艺术类","民办","浙江省东阳市横店镇都督南街138号","浙江横店影视职业学院是浙江省目前唯一的以“影视”为特色、涵盖相应领域相关专业的高职院校，地处全国首个国家级影视产业实验区——浙江横店影视产业实验区内，入驻该区中外影视企业达1800多家；学院坐落于被誉为“中国好莱坞”的横店影视城内。学院是省先进基层党组织、省文明单位、省“平安校园”、全国民办教育先进集体。浙江横店影视职业学院是为完善影视"
"湖北第二师范学院","0","1931","1723","2","师范类","公办","湖北省武汉市东湖新技术开发区高新二路129号","湖北第二师范学院位于九省通衢的湖北省武汉市，是一所以教师教育为主要特色，经济学、法学、教育学、文学、理学、工学、管理学和艺术学等学科为支撑的省属普通本科院校，是湖北省教师教育的重要基地之一，是教育部人工智能助推教师队伍建设试点高校、教育部“互联网+中国制造2025”产教融合促进计划建设院校、湖北省“优师计划”主培学校和“湖北省2011计划”牵"
"浙江金融职业学院","0","1975","1205","2","财经类","公办","浙江省杭州市下沙高教园区东区学源街118号","浙江金融职业学院是习近平总书记关怀过的学校。2005年11月2日，时值学校办学30周年，时任浙江省委书记的习近平总书记给学校发来贺信，要求我校要坚持社会主义办学方向，牢固树立和全面落实科学发展观，继续发扬优良传统，全面推进素质教育，不断提高教育质量和办学水平，努力把学校建设成为具有自身特色的示范性高等职业院校，为社会培养出更多高素质的应用型人"
