"name","num_library","create_date","area","is_fenxiao","type_name","school_nature_name","address","content"
"益阳职业技术学院","0","2004","532","2","综合类","公办","湖南省益阳市迎风桥镇新塘村","益阳职业技术学院是2004年经省政府批准、教育部备案，由益阳市人民政府举办的全日制公办高等职业院校（教育部备案编号：13808，在湘招生代码：4743）。前身是1972年建校的国家级重点中专原益阳地区农校和1979年建校的省部级重点中专原益阳地区供销（工贸）学校。2006年6月整体搬入现址（原益阳师专校址）。2016年8月，市政府将益阳商务电子职业中等专业学校划归学校管理"
"湖南理工职业技术学院","0","1978","293","2","综合类","公办","湖南省湘潭市建设路口河东大道10号","湖南理工职业技术学院是经省人民政府批准、国家教育部备案设立的全日制公办普通高等院校。学院始建于1978年，坐落在伟人故里大美湘潭的中心城区，校园精巧别致，绿树成荫，书香四溢。学院紧紧围绕落实立德树人根本任务，明确“悉心尽好一份责、精心讲好一堂课、用心读好一本书、全心育好一代人，持续打造全省产教融合样板，聚力创建全省高水平职业院校”的发展"
"湖南汽车工程职业学院","0","1957","1055","2","理工类","公办","石峰校区：湖南省株洲市石峰区红旗北路476号,云龙校区：湖南省株洲市云龙示范区智慧路79号","湖南汽车工程职业学院是由湖南省人民政府批准设立，株洲市人民政府和中国汽车工程学会共建的一所公办高职院校。2005年建院以来，学院坚持立德树人根本任务，以“立足汽车行业，服务汽车产业，培养汽车人才，打造汽车品牌”为办学定位，秉持“厚德、精技、笃学、致用”校训精神，获评中国特色A档高水平专业群建设单位、国家优质专科高等职业院校、国家级职教集团"
"湖南现代物流职业技术学院","0","1965","0","2","综合类","公办","湖南省长沙市远大二路泉塘","湖南现代物流职业技术学院是湖南省楚怡高水平高职学校建设计划建设单位A档、湖南省人民政府和中国物流与采购联合会共建院校、教育部人才培养工作水平评估优秀院校、湖南省示范性高职学院、湖南省文明校园，首批国家级职业教育教师教学创新团队立项建设单位、第一批国家级示范性职业教育集团（联盟）培育单位、首批全国五个1+X证书制度试点专业牵头单位、国家现"
"湖南工艺美术职业学院","0","1975","359","2","艺术类","公办","湖南省益阳市赫山区栖霞路135号","◆中国特色高水平专业群建设单位（A档）◆国家示范性（骨干）高职院校◆湖南省卓越高职学院◆湖南省第五届黄炎培优秀学校◆国家级优质专科高等职业院校◆湖南省社科研究基地◆湖南省高校宣传思想工作研究与实践先进单位◆湖南省高校大学生创新创业孵化示范基地◆全国普通高校创新创业典型经验高校50强◆学校“众创梦工场”获批国家级众创空间◆全国高等职业院"
"长沙电力职业技术学院","0","1956","400","2","理工类","公办","湖南省长沙市经济技术开发区盼盼路（泉塘）","长沙电力职业技术学院（以下简称“学院”）是湖南省唯一的电力类公办全日制普通高校，隶属于国网湖南省电力有限公司，教育业务由湖南省教育厅管理，与国网湖南省电力有限公司技术技能培训中心（以下简称“技培中心”）实行“两块牌子、一套人马”的管理模式。学院始建于1956年，原名为湖南省电力技工学校、长沙电力学校，2005年升格为高职院校，现有在校生3245人"
"湖南高速铁路职业技术学院","0","1951","800","2","理工类","公办","湖南省衡阳市珠晖区三环东路南9号","湖南高速铁路职业技术学院前身为衡阳铁路工程学校，1951年由铁道部创办。2004年划归市委、市政府管理，2005年升格为湖南交通工程职业技术学院，2011年更名为湖南高速铁路职业技术学院，2014年整体搬迁到酃湖高铁新城。学院是湖南省“楚怡”高水平高职学校、省卓越高职院校、省文明标兵校园、省深化新时代教育评价改革试点高校，拥有国家级职教集团、国家级众创空间、"
"湖南交通工程学院","0","1991","1265","2","理工类","民办","湖南省衡阳市蒸湘区解放大道430号","湖南交通工程学院，坐落在中国历史文化名城衡阳，是经教育部批准成立的一所全日制普通本科高校。其前身系1991年创办的衡阳市中南技工学校，2018年获学士学位授予权。经过32年的建设与发展，学校形成了鲜明的办学特色和综合性学科格局。学校现设交通运输工程学院、机电工程学院、电气与信息工程学院、经济管理学院、医学技术与护理学院、人文与艺术学院、马克思主"
"湖南铁路科技职业技术学院","0","1956","514","2","理工类","公办","湖南省株洲市石峰区云龙职教城智慧路1号","湖南铁路科技职业技术学院是经湖南省人民政府批准、教育部备案设立的公办全日制高等学校，由原铁道部创建于1956年，原名株洲铁路机械学校。2004年铁路主辅分离，学院由中国铁路广州局集团有限公司移交株洲市政府主办、湖南省教育厅业务主管，2005年3月升格为全日制高职学院。2013年8月，学校首批搬迁至云龙示范区职教大学城，校区占地面积514亩，建筑面积22.8万平方米"
"湖南安全技术职业学院","36万","1984","500","2","理工类","公办","湖南省长沙市万家丽北路66号","湖南安全技术职业学院、长沙煤矿安全技术培训中心（以下简称学校）位于湖南省会长沙，地处长沙市万家丽路、地铁5号线北段。学校由湖南省人民政府和应急管理部（国家矿山安全监察局）共建共管，是全国第一所以“安全”命名的全日制公办高等职业院校，实行“一个机构、两块牌子、两种体制、一体化运行”的办学方式。1984年，联合国国际劳工组织与我国政府共同创建"
"湖南电气职业技术学院","0","1941","728","2","理工类","公办","湖南省湘潭市岳塘区下摄司街2号","学院创办于1941年，是经湖南省人民政府批准的全日制公办高等职业院校，前身为国民政府资源委员会中央电工器材总厂艺徒训练学校，是全国成立最早的技能人才培养基地。2012年，立项为湖南省示范性（骨干）高职院校，2016年以“优秀”等级通过湖南省示范性（骨干）高职院校的验收。多年来，学院站在职业教育发展的前沿，始终坚持以立德树人为根本，以服务发展为宗旨"
"湖南信息学院","0","1997","1000","2","理工类","民办","湖南省长沙市（星沙）经济技术开发区毛塘工业园","湖南信息学院是一所应用型本科高校，位于中国历史文化名城长沙，坐落于国务院原总理朱镕基的家乡——长沙经济技术开发区毛塘工业园。湖南信息学院创办于1997年，2004年升格为高职专科院校，2014年经教育部批准升格为本科院校，2021年经湖南省教育厅等部门批准为硕士学位授予立项建设单位。学校设有计算机科学与工程学院、电子科学与工程学院、管理学院、国际商学院"
"湖南应用技术学院","0","1994","2146","2","综合类","民办","湖南省常德市鼎城区善卷路2508号","湖南应用技术学院是教育部批准的全日制本科院校。学校始创于1994年，时称常德电脑技术学校；1998年成为高等教育学历文凭试点院校，更名为常德电脑专修大学；2004年升格为国家统招大专院校，更名为湖南同德职业学院；2014年升格为国家统招本科院校，更名为湖南应用技术学院。学校现有东、西两个校区，规划总面积2146.07亩。目前校园占地面积1765.28亩，建筑总面积51.48万平"
"湖南软件职业技术大学","0","2001","900","2","理工类","民办","湖南省湘潭市国家级湘潭九华经济技术开发区开源路（原宝马西路）1号","学校前身是2001年成立的湖南托普信息职业技术学院。2005年经省人民政府批准、教育部备案，成立湖南软件职业学院。2020年6月29日，经教育部批复同意，学校升格为本科层次职业学校。2021年5月14日，经教育部批复同意，学校更名为湖南软件职业技术大学。学校位于毛主席家乡湖南省湘潭市，占地面积900余亩。现设有软件与信息工程学院、现代设计学院、经济管理学院、建筑工"
"潇湘职业学院","0","1989","548","2","综合类","民办","湖南省娄底市经济技术开发区","娄底潇湘职业学院是经湖南省人民政府批准、教育部备案，列入国家统招计划的全日制普通高等职业院校，系省属民办优秀高职院校和精神文明单位。学校起源于1989年，2018年由中国企业500强之一的大汉控股集团独资举办，是一所培养高素质技术技能型专门人才的高等职业院校。学校占地面积548亩，总建筑面积18.6万平方米，现有教职员工540人，其中教授18人、副教授57人，双师"
"湖南电子科技职业学院","0","2007","1448","2","综合类","民办","湖南省长沙市望城区旺旺西路158号","湖南电子科技职业学院是经湖南省人民政府批准、教育部备案的具有独立颁发高等教育学历文凭资格的全日制普通高等院校，学校共有两个校区，北校区位于湖南省长沙市望城区旺旺西路158号，东校区位于湖南省长沙市浏阳经济技术开发区金阳大道3050号。学校笃行“立德树人、教书育人”的办学理念，秉承&quot;专家治校、名师治学&quot;的办学方式，以&quot;厚德强能、求是致远&"
"湖南外国语职业学院","0","1993","1061","2","语言类","民办","湖南省长沙市望城区丁字湾街道京阳大道","湖南外国语职业学院的前身是成立于1993年的浏阳外国语学校。1997年更名为浏阳外国语进修学院。2006年，学校升格为普通高等职业学校，并更名为湖南外国语职业学院。学校拥有长沙和浏阳两个校区，占地1000多亩，主校区坐落于望城区丁字镇，设8个二级学院，现有教职员工近千人，学生15000余人，教学设施齐备，是一所现代化、智慧化、生态化的校园。历经30周年风雨洗礼与"
"广东食品药品职业学院","0","1965","1233","2","综合类","公办","广东省广州市天河区龙洞北路321号","广东食品药品职业学院是经广东省人民政府批准、教育部备案的公办全日制普通高等职业院校，是国家优质专科高等职业院校、中国特色高水平高职学校和专业建设计划立项建设单位、第一批国家示范性职业教育集团培育单位、教育部第二批现代学徒制试点单位、广东省示范性高职院校、广东省一流高职院校立项建设单位、广东省五一劳动奖状获得单位、广东省绿色学校。学"
"广东轻工职业技术学院","0","1933","1940","2","理工类","公办","广州校区：广东省广州市海珠区新港西路152号,南海校区：广东省佛山市南海软件科技园","广东轻工职业技术学院创建于1933年，是省属唯一国家示范性高等职业院校，中国特色高水平职业学校和高水平专业群（“双高计划”）建设单位，现有全日制在校生2万余人。学校前身是“广东省立第一职业学校”，至今已有88年职业教育历史，1959-1963年和1978-1983年两段时期，曾开办本科职业教育。学校坚持以习近平新时代中国特色社会主义思想为指导，贯彻党的教育方针，立"
"广东体育职业技术学院","0","1956","262","2","体育类","公办","广东省广州市天河区黄村奥体路52号","广东体育职业技术学院创建于1956年8月，前身是广东省体育运动学校，2003年5月经广东省人民政府批准，升格为全日制高等体育职业院校，前期隶属广东省体育局，2020年6月15日正式划转广东省教育厅。建校以来，培养和涌现出了冼东妹、傅海峰、江嘉良、孙彩云、董兆致等一大批为国家作出突出贡献的体育明星。办学理念弘扬体育精神、勤学体育知识、精练体育技能。学院校训"
"湖南都市职业学院","0","2004","1262","2","综合类","民办","湖南省长沙市远大三路1970号","湖南都市职业学院是经湖南省人民政府批准，教育部备案的一所全日制普通高职院校，学校现有占地总面积841864.4平方米，教学行政用房面积177382.8平方米，教学仪器设备总值658850元；馆藏图书80.09万册，电子版图书43.56万册。学校设有航空与城轨管理学院、包装与艺术学院、建筑工程学院、汽车与机电工程学院、商学院、信息科学与工程学院、师范教育学院、医卫学院及马克思"
"广东科贸职业学院","0","1985","1100","2","综合类","公办","清远校区：广东省清远市清城区中宿路36号,天河校区：广东省广州市天河区科华街273号,白云校区：广东省广州市白云区石庆路388号","广东科贸职业学院，是省政府举办的高等职业学校，前身是被誉为“广东农业科技与管理干部摇篮”的广东省农业管理干部学院，成立于1985年。学校现有省职教城（清远）、广州白云和广州天河共三个校区。学校是农业农村部和教育部联合推介的乡村振兴人才培养优质校、国家示范性职业教育集团培育牵头单位、广东省示范性高等职业院校、广东省域高水平高等职业院校建设"
"广州科技贸易职业学院","0","1984","0","2","综合类","公办","广东省广州市番禺区南村镇市新路北段669号,花果山校区：广东省广州市越秀区童心路西胜街42号科协大院5号楼","学校简介：广州科技贸易职业学院(以下简称“学校”)地处粤港澳大湾区核心城市——广州，是广东省全日制普通高职院校。著名科学家、中国工程院院士、广州市科学技术协会名誉主席钟南山担任名誉院长。学校地理位置优越，校园环境优美，立足于服务广州市及粤港澳大湾区科技与商贸两大板块，以番禺校区（毗邻广州大学城）为中心，北进广州开发区、南拓南沙自贸区，"
"中山职业技术学院","0","2006","810","2","综合类","公办","广东省中山市东区博爱七路25号","中山职业技术学院位于我国伟大民主革命先行者孙中山先生的故乡—广东省中山市，是市政府投资兴办的全日制普通高等学校，占地810亩。始建于2004年12月，是“国家优质专科高等职业院校”“全国示范性职业教育集团（联盟）培育单位”“广东省示范性高等职业院校”“广东省一流高职院校建设单位”和“省域高水平高职院校”建设单位，入榜“全国高职院校服务贡献50强”"
"湖南九嶷职业技术学院","0","1980","300","2","综合类","公办","湖南省永州市冷水滩区永州大道2号","湖南九嶷职业技术学院是在1980年原国家学部委员、北京农业大学第一任校长、著名农林学家和教育家乐天宇教授回家乡—永州市宁远县创办的新中国第一所民办高校“九嶷山学院”的基础上发展壮大起来的。老一辈无产阶级革命家肖克、王首道、李维汉、曾三以及著名科学家钱学森、周培源等都担任过学院的董事。1985年时任团中央第一书记的胡锦涛同志给九嶷山学院团委回信"
"广州商学院","0","1999","1000","2","财经类","民办","广东省广州市黄埔区龙湖街九龙大道222号","广州商学院前身是华南师范大学增城学院，1999年招生第一批学生，2002年成为广东省第一所新机制二级学院，2004年成为全国第一批、广东省第一所独立学院。学校于2011年获得学士学位授予权；2014年成为广东省第一所由独立学院转设的普通本科高校；2020年顺利通过教育部本科教学工作合格评估，是该年广东唯一一所，也是全国四所通过评估的民办高校之一；2021年成为广东省第"
"广州城市理工学院","107万","2005","1753","2","理工类","民办","广东省广州市花都区学府路1号","广州城市理工学院（原华南理工大学广州学院）是经教育部批准设立的一所以工科为主，经济、管理、文学、理学、艺术协调发展的多科性应用型学校。2006年由广州云峰企业、华南理工大学合作创办，2021年经教育部批准转设为广州城市理工学院，系独立设置的本科层次民办普通高等学校。学校位于粤港澳大湾区的核心城市广州，占地面积1753亩，建有14个实验中心，包括5个基"
"广州华立学院","0","1999","2000","2","理工类","民办","广东省广州市增城区广州华立科技园华立路11号","广州华立学院（原广东工业大学华立学院）建于1999年，2004年经教育部批准，成为广东省第一批独立学院，全面实施本科教育。2021年经教育部同意，转设为广州华立学院。学校现有广州增城和江门银湖湾两个校区，校园占地近2000亩；设有15个二级学院、44个本科专业，在校全日制普通本科生21200余人，是一所工学、经济学、管理学、文学、艺术学、教育学等多学科协调发展，毕"
"华南农业大学珠江学院","120万","2006","700","2","综合类","民办","广东省广州市从化区江埔街广从北路2004号","华南农业大学珠江学院是经国家教育部批准设立，实施本科层次教育的独立学院。学校办学定位：致力于所立足广东区域经济发展，以现代传媒为重点，应用艺术为特色，多学科协调发展的国际化水平较高的应用技术成了“四个特色”：面向市场的办学特色，技术与学术并重的教学特色，讲求实际的育人特色，国际化的发展特有6个二级学院（传媒学院、设计学院、外国语学院"
"广州理工学院","0","2000","1538","2","综合类","民办","广东省广州市白云区太和兴太三路638号","广东省民办本科高校第一批硕士学位授予立项建设单位广东省十三五时期转设的第一所独立学院广东民办教育四十年“突出贡献机构”广东省博士工作站设站单位广州市知识产权试点学校广东省连续多年就业工作先进单位广东省创新创业工作先进单位就业率连续多年保持全省高位2021年6月校友会排名全国民办本科高校30位广州理工学院（GuangzhouInstituteofScienceandTechnology）坐落在广"
"广州华商学院","0","2006","1800","2","财经类","民办","广州增城校区：广东省广州市增城区荔湖街华商路1号,肇庆四会校区：广东省肇庆市四会市东城街道黄岗社区工业大道1号","广州华商学院是一所财经特色鲜明、多学科协调发展的全日制应用型本科高等学校，现有广州增城和肇庆四会两个校区，涵盖经、管、文、工、艺、教、理、医等多学科，在校学生29000多人。自创办以来，我校坚持“创百年名校，育华夏英才”的办学理念，狠抓质量、苦练内功，增内涵、强特色、树品牌，专业结构不断优化，科创成果相继涌现、人才培养成绩显著。学校先后荣"
"广东外语外贸大学南国商学院","0","1996","900","2","综合类","民办","广东省广州市白云区良田中路181号","广东外语外贸大学南国商学院是一所由广东外语外贸大学举办、国家教育部批准建立的本科层次的独立学院。学校位于中国著名历史文化名城和华南经济文化中心广州市，坐落在广州市白云区105国道（广从公路）旁，占地面积900余亩。校园环境幽雅、空气清新、湖光山色、绿树成荫。学校办学设备设施完善，师资力量优良，教学管理严格，是莘莘学子治学成才的理想之地。学"
"广州珠江职业技术学院","0","2006","1186","2","综合类","民办","广州校区：广东省广州市增城区增江街塔山大道2号,福田校区：广东省惠州市博罗县福田镇莲塘岗学院路1号","广州珠江职业技术学院是经广东省人民政府批准设立，国家教育部备案的一所综合性全日制普通高等职业学院，承担国家计划省内招生任务，面向全国招生，专业设置涵盖医药卫生、教育与体育、文化艺术、新闻传播、土木建筑、装备制造、交通运输、电子与信息、财经商贸、公安与司法、公共管理与服务等几大类。有医药健康学院、教育学院、经济管理学院、信息工程技术"
"广州松田职业学院","0","2006","500","2","综合类","民办","广东省广州市增城区朱村大道东432号（广州地铁21号线山田站或朱村站）","广州松田职业学院成立于2006年9月，是经省政府批准、教育部备案的全日制普通高等职业院校。学校座落于广深科技创新走廊的重要节点、中国最美的荔枝之乡——广州市增城区。校园依山而建，环境幽美，交通便利，毗邻广州地铁21号线山田站、朱村站，靠近北三环高速（珠三角环线高速）朱村东出入口。学校图书馆馆藏纸质图书45万册，电子图书108.4万册，校园内无线WIFI和5G"
"广东文理职业学院","0","1989","1590","2","综合类","民办","广东省廉江市九洲江大道78号","广东文理职业学院是广东省人民政府批准成立，国家教育部备案，面向全国招收国家任务生的全日制普通高等院校，隶属广东省教育厅，学院申请升格本科已纳入《广东省高等学校设置“十三五”规划》。2017年10月，学院的升本工作通过了广东省教育厅专家组的现场考核，经省高等学校设置专家委员会评议通过，并将学院的升格材料上报教育部。学院坐落在南海之滨的中国首"
"和田师范专科学校","0","1938","1674","2","师范类","公办","新疆维吾尔自治区和田市北京西路169号","【学校简介】和田师范专科学校原为新疆维吾尔自治区直属的一所全日制师范类普通高校，2018年7月转隶和田地区管理，主管单位为和田地区行政公署。学校位于和田市北京西路169号，始建于1938年“简易师范”，1957年改名为和田师范学校，1978年经国家教育部、自治区人民政府批准，升格为和田师范专科学校。学校始终坚持社会主义办学方向，紧紧围绕立德树人根本任务，追求"
"新疆工程学院","0","1958","1930","2","理工类","公办","主校区：新疆维吾尔自治区乌鲁木齐市经济技术开发区（头屯河区）科创路1350号 ,南昌路校区：新疆维吾尔自治区乌鲁木齐市南昌路236号","新疆工程学院是新疆维吾尔自治区人民政府举办、教育厅主管的普通本科院校，坐落在美丽的乌鲁木齐。学校因煤而建，因工而兴。1958年，中国人民解放军总后方勤务部第二预备学校163名官兵转业到新疆，组建了乌鲁木齐煤矿学校。1985年更名为新疆煤炭专科学校，1994年更名为新疆工业高等专科学校，2012年经教育部批准升格为新疆工程学院，同年新疆机电职业技术学院并入。6"
"新疆警察学院","0","1950","1209","2","政法类","公办","长沙路校区：新疆维吾尔自治区乌鲁木齐市新市区长沙路1108号,米东校区：新疆维吾尔自治区乌鲁木齐市米东区柏河乡开泰北路5428号","新疆警察学院由自治区人民政府举办、公安厅管理、教育厅业务指导，是西北地区唯一的公安本科院校。其前身是1950年成立的新疆省人民公安学校，2002年组建新疆警官高等专科学校，2012年3月，经教育部批准成立新疆警察学院。学院是“新疆公安警察培训基地”“公安部警务实战训练新疆警察学院基地”。2016年5月增列为学士学位授权单位。学院坚持服务新疆公安工作、服务"
"乌鲁木齐职业大学","0","1985","2110","2","综合类","公办","老校区：新疆维吾尔自治区乌鲁木齐市幸福路723号,新校区：新疆维吾尔自治区乌鲁木齐市头屯河区祥云中街566号","乌鲁木齐职业大学成立于1985年，是乌鲁木齐市属唯一一所综合性全日制普通高等职业院校，是改革开放后新疆成立的第一所高等职业院校。2007年，经新疆维吾尔自治区人民政府批准，原乌鲁木齐职业大学与乌鲁木齐成人教育学院合并，组建新的乌鲁木齐职业大学，实行区市共建、以市为主的管理体制。乌鲁木齐职业大学现有5个校区，占地2109.5亩。学校总资产7亿元，拥有224个"
